{
  "$schema": "http://json-schema.org/draft-07/schema#",
  "title": "TaskCard",
  "type": "object",
  "required": [
    "task_id",
    "title",
    "from",
    "to",
    "goal",
    "brief",
    "tags",
    "constraints",
    "deliverables",
    "review_required",
    "workflow_mode",
    "current_stage",
    "document_bundle_version",
    "required_documents",
    "document_status",
    "user_confirmation",
    "code_change_targets",
    "handoff_history",
    "status"
  ],
  "properties": {
    "task_id": {
      "type": "string",
      "minLength": 1
    },
    "title": {
      "type": "string",
      "minLength": 1
    },
    "from": {
      "type": "string",
      "minLength": 1
    },
    "to": {
      "type": "string",
      "minLength": 1
    },
    "goal": {
      "type": "string",
      "minLength": 1
    },
    "brief": {
      "type": "string",
      "minLength": 1
    },
    "tags": {
      "type": "array",
      "items": {
        "type": "string"
      }
    },
    "constraints": {
      "type": "array",
      "items": {
        "type": "string"
      }
    },
    "deliverables": {
      "type": "array",
      "items": {
        "type": "string"
      }
    },
    "review_required": {
      "type": "boolean"
    },
    "workflow_mode": {
      "type": "string",
      "enum": [
        "generic_governance",
        "6a",
        "6ayh",
        "sdd",
        "ppw",
        "project_init",
        "planning",
        "progressive_refactor",
        "risk_review",
        "technical_decision",
        "architecture_audit",
        "quick_decompose",
        "custom"
      ]
    },
    "current_stage": {
      "type": "string",
      "minLength": 1
    },
    "document_bundle_version": {
      "type": "string",
      "pattern": "^v[1-9][0-9]*$"
    },
    "required_documents": {
      "type": "array",
      "items": {
        "type": "object",
        "required": [
          "path",
          "purpose",
          "status"
        ],
        "properties": {
          "path": {
            "type": "string",
            "minLength": 1
          },
          "purpose": {
            "type": "string",
            "minLength": 1
          },
          "status": {
            "type": "string",
            "enum": [
              "missing",
              "planned",
              "bootstrapped",
              "in_progress",
              "updated",
              "completed",
              "waived"
            ]
          },
          "owner": {
            "type": "string"
          },
          "notes": {
            "type": "string"
          }
        },
        "additionalProperties": false
      },
      "default": []
    },
    "document_status": {
      "type": "string",
      "enum": [
        "not_required",
        "pending",
        "bootstrapped",
        "in_progress",
        "ready",
        "completed"
      ]
    },
    "user_confirmation": {
      "type": "object",
      "required": [
        "status"
      ],
      "properties": {
        "status": {
          "type": "string",
          "enum": [
            "not_required",
            "pending",
            "confirmed",
            "rejected"
          ]
        },
        "confirmed_by": {
          "type": "string"
        },
        "confirmed_at": {
          "type": "string"
        },
        "document_bundle_summary": {
          "type": "string"
        },
        "notes": {
          "type": "string"
        }
      },
      "additionalProperties": false
    },
    "execution_plan": {
      "type": "array",
      "items": {
        "type": "object",
        "required": [
          "step",
          "owner"
        ],
        "properties": {
          "step": {
            "type": "string"
          },
          "owner": {
            "type": "string"
          },
          "notes": {
            "type": "string"
          }
        },
        "additionalProperties": false
      },
      "default": []
    },
    "code_change_targets": {
      "type": "array",
      "items": {
        "type": "object",
        "required": [
          "path",
          "change_summary"
        ],
        "properties": {
          "path": {
            "type": "string",
            "minLength": 1
          },
          "start_line": {
            "type": "integer",
            "minimum": 1
          },
          "end_line": {
            "type": "integer",
            "minimum": 1
          },
          "change_summary": {
            "type": "string",
            "minLength": 1
          },
          "before_context": {
            "type": "string"
          },
          "after_context": {
            "type": "string"
          },
          "notes": {
            "type": "string"
          }
        },
        "additionalProperties": false
      },
      "default": []
    },
    "handoff_history": {
      "type": "array",
      "items": {
        "type": "object",
        "required": [
          "handoff_id",
          "from",
          "to",
          "status_before",
          "status_after",
          "reason",
          "responsibility_notice"
        ],
        "properties": {
          "handoff_id": {
            "type": "string"
          },
          "from": {
            "type": "string"
          },
          "to": {
            "type": "string"
          },
          "status_before": {
            "type": "string"
          },
          "status_after": {
            "type": "string"
          },
          "reason": {
            "type": "string"
          },
          "responsibility_notice": {
            "type": "string"
          },
          "decision_summary": {
            "type": "string"
          }
        },
        "additionalProperties": true
      },
      "default": []
    },
    "dispatch_queue_event": {
      "type": "object",
      "required": [
        "event",
        "owner",
        "affected_workers",
        "admitted_count",
        "queued_count",
        "max_queue_depth",
        "status_effect"
      ],
      "properties": {
        "event": {
          "type": "string",
          "enum": [
            "gateway_rate_limit_queue"
          ]
        },
        "owner": {
          "type": "string",
          "enum": [
            "orchestrator"
          ]
        },
        "affected_workers": {
          "type": "array",
          "items": {
            "type": "string"
          }
        },
        "admitted_count": {
          "type": "integer",
          "minimum": 0
        },
        "queued_count": {
          "type": "integer",
          "minimum": 0
        },
        "max_queue_depth": {
          "type": "integer",
          "minimum": 0
        },
        "retry_after": {
          "type": "string"
        },
        "queue_policy": {
          "type": "string",
          "enum": [
            "queue_to_max_gateway_capacity"
          ]
        },
        "status_effect": {
          "type": "string",
          "enum": [
            "remain_executing",
            "blocked"
          ]
        },
        "notes": {
          "type": "string"
        }
      },
      "additionalProperties": false
    },
    "artifacts": {
      "type": "array",
      "items": {
        "type": "object",
        "required": [
          "producer",
          "kind",
          "summary"
        ],
        "properties": {
          "producer": {
            "type": "string"
          },
          "kind": {
            "type": "string"
          },
          "summary": {
            "type": "string"
          }
        },
        "additionalProperties": true
      },
      "default": []
    },
    "status_reason": {
      "type": "string"
    },
    "approved_by": {
      "type": "string"
    },
    "rejected_by": {
      "type": "string"
    },
    "rejection_reason": {
      "type": "string"
    },
    "required_fixes": {
      "type": "array",
      "items": {
        "type": "string"
      },
      "default": []
    },
    "status": {
      "type": "string",
      "enum": [
        "submitted",
        "triaged",
        "planned",
        "under_review",
        "approved",
        "dispatched",
        "executing",
        "aggregated",
        "completed",
        "needs_revision",
        "blocked",
        "rejected",
        "cancelled"
      ]
    }
  },
  "additionalProperties": true
}
